{"currentBackend":"TotalPower","currentDevice":0,"currentRecorder":"FitsZilla","maxScanID":0,"maxSubScanID":0,"projectCode":"Maintenance","restFrequency":[0.0],"scanID":0,"scheduleName":"","status":"OK","subScanID":0,"timestamp":{"iso8601":"2025-11-21T11:45:01.497Z","mjd":61000.489600659814,"omg_time":139830183014975870,"unix_time":1763725501.497587},"tracking":true}
